mr,output
"name[name_x], food[food_x], priceRange[priceRange_x], customer rating[customer rating_x], familyFriendly[yes], near[near_x]",name_x is a familyfriendly_x eattype_x located at the area_x area food_x area_x familyfriendly_x food_x food_x food_x familyfriendly_x food_x food_x familyfriendly_x food_x familyfriendly_x area_x familyfriendly_x food_x familyfriendly_x food_x familyfriendly_x area_x familyfriendly_x the for kids area food_x the best food_x cuisine for area_x or dinner friendly for kids and the atmosphere is familyfriendly_x the price range is pricerange_x the the of  area_x the familyfriendly_x the area area_x the familyfriendly_x area_x the for kids area of 
"name[name_x], food[food_x], customer rating[customer rating_x], familyFriendly[yes]",name_x food_x a food_x food_x food_x serves food_x it is located in the area area_x area near near_x to the near_x the trip will be familyfriendly_x it is the area_x area   in the area_x area the is the area the area  area_x the area_x the area is will area_x next to the near_x in the area_x area  is the trip will be provided for dining and the trip will be familyfriendly_x
"name[name_x], priceRange[priceRange_x], customer rating[customer rating_x], familyFriendly[no]",name_x is a eattype_x that serves food_x food a customer rating_x customer rating customer rating_x customer rating_x customer rating_x customer rating_x customer rating_x rating_x customer rating_x customer rating_x rating_x customer rating_x customer rating_x rating_x customer rating_x rating_x customer  rating rating_x rating_x rating_x customer rating_x rating_x rating_x customer rating_x rating customer rating_x rating_x rating_x rating_x customer rating_x of rating rating_x rating_x rating_x rating_x customer rating_x of all food_x food and the is is are welcome
"name[name_x], food[food_x], priceRange[priceRange_x], customer rating[customer rating_x], area[area_x], familyFriendly[yes]",name_x is is is is is is is near_x they near range is is is customer rating_x has and a customer rating_x customer rating customer customer rating_x customer is customer is customer is customer is customer rating_x customer rating_x customer rating_x customer rating_x customer rating_x customer rating_x rating_x customer rating_x rating_x customer rating_x rating_x customer rating_x rating_x customer rating_x rating_x customer rating_x rating_x rating_x customer rating_x rating_x rating_x customer rating_x rating_x rating_x rating_x customer rating_x
"name[name_x], food[food_x], priceRange[priceRange_x], area[area_x], near[near_x]",name_x is a eattype_x eattype_x in a eattype_x that is familyfriendly_x price range area_x is is familyfriendly_x is price range pricerange_x is familyfriendly_x is familyfriendly_x is familyfriendly_x familyfriendly_x area_x familyfriendly_x allowed the kids allowed kids familyfriendly_x the atmosphere not familyfriendly_x allowed families is for kids allowed families is familyfriendly_x the price range is pricerange_x it is familyfriendly_x the area_x area t is kids kids kids kids kids area near the low price range is 
"name[name_x], eatType[eatType_x], priceRange[priceRange_x], customer rating[customer rating_x], familyFriendly[yes]",pricerange_x is a eattype_x located near near_x near_x near_x near_x located near near_x by near_x this affordably provides food_x food of  pricerange_x prices at a price range of pricerange_x  pricerange_x price range pricerange_x to the near_x  are in the pricerange_x price range are pricerange_x a pricerange_x near_x pricerange_x are pricerange_x near_x pricerange_x pricerange_x pricerange_x pricerange_x the range range pricerange_x pricerange_x pricerange_x pricerange_x the range of pricerange_x pricerange_x the range of pricerange_x the
"name[name_x], eatType[eatType_x], food[food_x], customer rating[customer rating_x], area[area_x], familyFriendly[no], near[near_x]",name_x with a customer rating_x customer rating customer rating_x customer rating_x rating_x rating_x customer rating_x of customer rating_x rating_x rating_x rating_x rating_x rating_x rating_x customer rating_x rating_x of rating_x rating_x rating_x rating_x rating_x rating_x customer rating_x rating_x customer rating_x rating_x rating_x customer rating_x rating_x rating_x rating_x rating_x customer rating_x rating_x rating_x rating_x customer rating_x rating_x rating_x rating_x customer rating_x rating_x rating_x rating_x customer rating_x rating_x rating_x rating_x customer rating_x rating_x rating_x rating_x customer rating_x rating_x
"name[name_x], eatType[eatType_x], customer rating[customer rating_x], area[area_x], near[near_x]",name_x food_x food_x food they are familyfriendly_x they are familyfriendly_x they are said to be familyfriendly_x that is familyfriendly_x the food_x the name_x young are welcome to young children young children the name_x inside playgrounds that s why their meals should visit name_x for food_x the city centre it is a low food_x restaurant that is the city centre customer is the city centre of the city centre for their familyfriendly_x inside playgrounds that s
"name[name_x], food[food_x], customer rating[customer rating_x], area[area_x], familyFriendly[no]",there is a customer rating_x out of customer rating it is located near near_x and is familyfriendly_x name_x near_x name_x name_x name_x name_x name_x near_x of out  of name_x of  of name_x  of out of  of  of name_x  of out  of  of out  of out  of out  of out  of out  of out  of out  of out  of out
"name[name_x], eatType[eatType_x], food[food_x], priceRange[priceRange_x], familyFriendly[yes], near[near_x]",name_x good area_x food_x a customer rating_x out of star rated food_x near near_x and is familyfriendly_x pricerange_x to near_x  customer rating_x out of  near to near_x  to the get  food  food to the near_x   to   place to eat the pricerange_x price range is pricerange_x near_x nearby  is out of  name_x  to the near_x   to  pricerange_x range and a price
"name[name_x], eatType[eatType_x], food[food_x], priceRange[priceRange_x], customer rating[customer rating_x out of 5], familyFriendly[yes], near[near_x]",name_x is a in area_x near near_x is is it customer customer rating_x are customer rating_x rating_x are customer rating_x rating_x range of pricerange_x customer customer rating_x familyfriendly_x of rating customer rating_x rating_x of familyfriendly_x customer of rating_x of familyfriendly_x area_x of the of rating area_x rating_x customer of familyfriendly_x of area_x the of familyfriendly_x area_x close to near_x the price range of pricerange_x euros familyfriendly_x the atmosphere give it a customer rating_x customer rating
"name[name_x], priceRange[priceRange_x], customer rating[customer rating_x], familyFriendly[yes]",name_x is a highly rated eattype_x which serves food_x food and is located near near_x in the area_x familyfriendly_x and is customer rating_x near_x not familyfriendly_x familyfriendly_x to near_x near_x customer the area_x customer rating familyfriendly_x customer familyfriendly_x area_x familyfriendly_x the near_x not familyfriendly_x familyfriendly_x area_x the customer rating familyfriendly_x area_x familyfriendly_x the customer rating familyfriendly_x area_x children the customer rating_x near_x the customer rating familyfriendly_x area_x not familyfriendly_x the of familyfriendly_x area_x familyfriendly_x the
"name[name_x], food[food_x], priceRange[priceRange_x], area[area_x]",name_x food_x a customer rating_x food_x it is located in the area_x it serves food_x customer rating_x rating customer rating_x the near_x customer rating familyfriendly_x of customer rating the customer rating_x rating the to near_x customer the area_x close to the near_x in the area_x area customer rating customer rating_x customer rating the customer rating of customer close to the near_x close to the near_x in the area_x area customer rating and customer rating_x customer
"name[name_x], eatType[eatType_x], near[near_x]",name_x is a eattype_x that serves customer rating_x customer ratings rating and customer rating_x customer customer rating_x customer customer rating_x customer rating_x customer rating_x customer rating_x rating customer rating_x rating customer rating_x rating_x customer rating_x rating_x customer rating_x of rating rating_x customer rating_x rating_x rating_x customer rating_x of rating rating_x rating_x close to all food_x food that is a eattype_x eattype_x the price range is pricerange_x and is located are in the city centre of
"name[name_x], eatType[eatType_x], food[food_x], area[area_x], familyFriendly[yes], near[near_x]",name_x is a pricerange_xly priced food_x joint located near near_x they are said to be familyfriendly_x called name_x offer at name_x prices are pricerange_x for their familyfriendly_x inside playgrounds that s why their familyfriendly_x inside playgrounds that s why their meals should want to near_x are said to be familyfriendly_x it is located near the near_x and the range are pricerange_x and the price range is pricerange_x the and other fatty a food_x atmosphere the
"name[name_x], food[food_x], priceRange[priceRange_x], customer rating[customer rating_x], area[area_x]",name_x food_x a food_x restaurant customer located in the area_x customer customer it has customer a customer rating customer rating_x customer rating customer rating customer rating familyfriendly_x of customer rating of customer rating of rating_x familyfriendly_x of customer rating the familyfriendly_x of area_x familyfriendly_x all food_x food and the familyfriendly_x is the familyfriendly_x atmosphere the area_x familyfriendly_x the familyfriendly_x atmosphere the of for young familyfriendly_x it is located in the area_x area and the atmosphere
"name[name_x], eatType[eatType_x], food[food_x], priceRange[priceRange_x], familyFriendly[yes], near[near_x]",name_x food_x a food_x priced food_x is is is is is is customer customer is is is customer is customer is is customer is is is customer is is is customer is is is customer is is is customer to near_x located near the familyfriendly_x customer customer rating customer rating_x children and the to all children and the atmosphere is familyfriendly_x expensive  pricerange_x range it the of rating is located near the near_x the
"name[name_x], eatType[eatType_x], food[food_x], priceRange[priceRange_x], customer rating[customer rating_x], area[area_x], familyFriendly[yes], near[near_x]",name_x is a food place with a price range pricerange_x and is familyfriendly_x in the area_x area is is familyfriendly_x is area familyfriendly_x area area familyfriendly_x pricerange_x at familyfriendly_x area_x area familyfriendly_x the area area area of familyfriendly_x on the area_x familyfriendly_x is the is area the price range is pricerange_x the area is no further is familyfriendly_x the familyfriendly_x is the familyfriendly_x is the familyfriendly_x is the is area familyfriendly_x the atmosphere is familyfriendly_x
"name[name_x], priceRange[priceRange_x], customer rating[customer rating_x]",name_x has a customer rating_x customer rating and familyfriendly_x in the area_x it pricerange_x and it the customer rating customer rating is customer rating_x rating_x rating_x rating_x rating_x rating_x rating_x rating_x rating_x rating_x rating_x rating_x rating_x rating_x rating_x rating_x rating_x rating_x rating_x rating_x rating_x rating_x rating_x rating_x rating_x rating_x rating_x rating_x rating_x rating_x rating_x rating_x rating_x rating_x rating_x rating_x rating_x rating_x rating_x rating_x rating_x rating_x rating_x rating_x rating_x rating_x rating_x rating_x rating_x rating_x rating_x rating_x
"name[name_x], eatType[eatType_x], food[food_x], customer rating[customer rating_x], area[area_x], familyFriendly[yes]",name_x food_x burger area_x food_x a price range is pricerange_x they serve food_x food and is familyfriendly_x is is is is is the is is area in the area area in area_x area the area area to the name_x in the area_x area near the name_x will be provided for dining at a good on the river there is a food_x restaurant that is familyfriendly_x the area price range is pricerange_x the pricerange_x the pricerange_x
"name[name_x], eatType[eatType_x], priceRange[priceRange_x], customer rating[customer rating_x], area[area_x], familyFriendly[yes], near[near_x]",there is a pricerange_x food_x eattype_x named name_x has a customer rating_x out of customer rating it has rating of customer out  in rating it out of  customer located in rating  it out area_x  located  to of   located  area_x out of  it to  located near to the city centre on the of the area_x near the near_x and the area_x is a  of out
"name[name_x], priceRange[priceRange_x], customer rating[customer rating_x], area[area_x], familyFriendly[yes], near[near_x]",name_x is a food_x eattype_x that familyfriendly_x to name_x  familyfriendly_x name_x food_x food_x food_x food_x food_x food_x young children young children for families is familyfriendly_x snacks at a eattype_x serving food_x cuisine name_x the best in the pricerange_x are a price range of  in the pricerange_x price range and are a eattype_x atmosphere of the city centre of the city centre area near the all age groups are in the area_x area near
"name[name_x], eatType[eatType_x], food[food_x], customer rating[customer rating_x], area[area_x]",name_x eattype_x located near near_x near_x as well as being a coffee shop the cricketers also sells food_x food and has an customer rating_x customer rating and familyfriendly_x and is suitable for kids and is considered to for kids friendly for kids for families is located near near_x in the and near_x the customer rating is customer rating_x rating_x the of customer rating_x rating_x familyfriendly_x to near_x  customer rating_x the customer rating rating_x rating_x
"name[name_x], food[food_x], priceRange[priceRange_x], customer rating[customer rating_x], area[area_x], familyFriendly[yes]",name_x is familyfriendly_x with customer rating_x customer rating and customer rating_x customer rating_x customer rating customer rating_x familyfriendly_x rating_x rating customer rating_x customer rating familyfriendly_x it is customer is familyfriendly_x is rating customer rating_x familyfriendly_x rating_x rating familyfriendly_x customer is rating familyfriendly_x rating_x familyfriendly_x customer is rating familyfriendly_x customer is familyfriendly_x rating_x rating familyfriendly_x customer is rating_x familyfriendly_x customer is rating familyfriendly_x rating_x customer is familyfriendly_x of rating familyfriendly_x rating_x familyfriendly_x kids are welcome to
"name[name_x], eatType[eatType_x], food[food_x], priceRange[priceRange_x], customer rating[customer rating_x], familyFriendly[yes]",name_x serves pricerange_xly priced food_x with a customer rating of customer rating_x and customer rating_x customer rating_x customer rating_x customer rating_x customer rating_x customer rating_x rating_x customer rating_x rating_x customer rating customer rating_x rating_x customer rating_x rating_x customer rating of customer rating_x rating_x rating_x rating_x customer rating_x of rating rating_x rating_x all age groups are offering burgers british and is not suitable for kids for kids for kids for kids for families is the city
"name[name_x], eatType[eatType_x], food[food_x], customer rating[customer rating_x], area[area_x], familyFriendly[yes], near[near_x]",there is a pricerange_x food_x eattype_x named name_x it has a customer rating of customer rating_x out of  customer rating  rating customer it out of  located in rating  it area_x located  to the city centre customer rating customer of  on the of  on the of out of  of  on families to get any better for a dinner menu for some food_x foods located at area_x the
"name[name_x], priceRange[priceRange_x], near[near_x]",name_x food_x a pricerange_x food_x from customer rating_x it is in the area_x area it is familyfriendly_x customer is customer rating customer  familyfriendly_x customer is familyfriendly_x of customer is familyfriendly_x of customer  familyfriendly_x of pricerange_x the area of customer  familyfriendly_x of of familyfriendly_x of the area of familyfriendly_x of familyfriendly_x of the area of  familyfriendly_x of the area of rating  familyfriendly_x customer the familyfriendly_x customer the rating area customer rating
"name[name_x], eatType[eatType_x], food[food_x], priceRange[priceRange_x], area[area_x], familyFriendly[yes], near[near_x]",name_x is food_x food_x food_x food_x food_x food_x food_x near_x customer located in area_x rating customer rating_x rating rating customer rating to near_x customer rating rating customer rating_x rating customer rating_x rating rating_x rating_x customer of rating rating_x rating_x customer rating_x close to near_x it the area_x rating but is a close to the city centre customer rating customer rating_x close to the city centre close to near_x the city centre customer rating by near_x
"name[name_x], food[food_x], priceRange[priceRange_x], customer rating[customer rating_x], area[area_x], familyFriendly[no], near[near_x]",name_x is a food_x restaurant located in in the area_x near near_x in is it is is customer out of   in is customer is  familyfriendly_x   out      to of    out of      familyfriendly_x to     in near_x   area_x    familyfriendly_x      familyfriendly_x     familyfriendly_x 
"name[name_x], food[food_x], priceRange[priceRange_x]",name_x is cheap rate and has a customer rating_x customer rating and a price pricerange_x range but is familyfriendly_x is the customer rating is customer is is rating_x rating_x rating_x customer rating_x rating_x rating_x rating_x pricerange_x customer rating_x familyfriendly_x of rating_x familyfriendly_x customer rating_x familyfriendly_x of familyfriendly_x customer is familyfriendly_x of familyfriendly_x customer is familyfriendly_x all familyfriendly_x and the price range is pricerange_x rating is pricerange_x the customer rating rating_x no children allowed customer rating
"name[name_x], food[food_x], priceRange[priceRange_x], familyFriendly[no]",name_x food_x a area_x that serves food_x food_x price range it familyfriendly_x is price range pricerange_x range familyfriendly_x familyfriendly_x and the range is familyfriendly_x is familyfriendly_x range is the is pricerange_x the familyfriendly_x area in the area_x area familyfriendly_x the range is familyfriendly_x area_x area the familyfriendly_x area_x the area the familyfriendly_x area_x the familyfriendly_x area_x the familyfriendly_x area the familyfriendly_x area_x the area the kids are welcome to  name_x where for kids are
"name[name_x], food[food_x], priceRange[priceRange_x], customer rating[customer rating_x], area[area_x], familyFriendly[yes], near[near_x]",name_x is a eattype_x that is located near near_x it has a customer rating_x customer customer rating and customer is customer is and customer is familyfriendly_x and near_x customer rating customer rating_x customer rating_x rating_x customer rating_x rating_x customer rating_x of familyfriendly_x rating_x customer rating_x rating_x of customer rating_x rating_x rating_x of familyfriendly_x rating_x customer rating_x of familyfriendly_x close to near_x customer rating_x customer rating_x the customer rating_x the customer rating rating_x customer rating_x of
"name[name_x], food[food_x], priceRange[priceRange_x], customer rating[customer rating_x], area[area_x], familyFriendly[yes], near[near_x]",name_x food_x a food restaurant pricerange_x in price range located in in the area_x area it is is range is is the range is pricerange_x is the area range area is the area in area_x area_x area_x area the area_x area the area_x area_x the area of the for area near the near_x in area_x area nearby the near_x in area_x area near the area_x is called name_x name_x will be provided for dining at
"name[name_x], food[food_x], priceRange[priceRange_x], area[area_x], familyFriendly[yes], near[near_x]",name_x is a food_x eattype_x with customer customer rating_x customer customer rating_x customer customer rating_x customer rating customer rating_x customer rating_x customer rating of customer rating_x rating_x customer rating_x of customer rating_x of rating rating_x rating_x rating_x customer rating_x of rating_x rating_x rating_x of rating_x rating_x for food_x for their food_x food service service to all age groups are for dinner you tied and a steal price range of  pricerange_x price range eattype_x name_x
"name[name_x], eatType[eatType_x], food[food_x], priceRange[priceRange_x], area[area_x], familyFriendly[yes]",name_x food_x a pricerange_x food_x from customer rating_x in area_x and familyfriendly_x is customer familyfriendly_x customer is customer rating familyfriendly_x customer is customer rating familyfriendly_x of customer  familyfriendly_x of rating_x area of rating_x familyfriendly_x of customer  familyfriendly_x of rating_x area of rating_x familyfriendly_x of the area of customer  familyfriendly_x of pricerange_x the customer rating_x the familyfriendly_x of customer rating_x the area of customer rating familyfriendly_x of rating_x all age groups are familyfriendly_x
"name[name_x], food[food_x], customer rating[customer rating_x], familyFriendly[yes], near[near_x]",name_x is an food_x just area_x eattype_x with a customer customer rating_x customer rating and a customer customer rating customer it customer has a customer customer rating_x customer rating_x customer rating_x customer rating customer rating_x rating_x rating_x customer rating_x rating_x of rating rating_x rating_x rating_x are pricerange_x customer rating_x the of rating rating_x rating_x rating_x are for kids area near the river and is located near the area_x in the pricerange_x price range and the
"name[name_x], eatType[eatType_x], food[food_x], customer rating[customer rating_x], area[area_x], familyFriendly[no], near[near_x]",name_x food_x familyfriendly_x cuisine cuisine cuisine name_x located near near_x located near_x the near_x the are welcome to near_x the waterman familyfriendly_x familyfriendly_x the atmosphere the atmosphere the atmosphere be familyfriendly_x it is next to the near_x will be provided for dining and the trip will be familyfriendly_x it is next to the near_x the trip will be provided at name_x at name_x it is not kids kids friendly and the family is the atmosphere
"name[name_x], food[food_x], priceRange[priceRange_x], customer rating[customer rating_x], familyFriendly[yes]",name_x is in the area_x area_x is has customer a customer has customer is customer has customer is customer is has customer pricerange_x and customer it customer is familyfriendly_x range is customer is is familyfriendly_x of customer  customer is is familyfriendly_x of pricerange_x customer is not familyfriendly_x customer of customer is familyfriendly_x of familyfriendly_x customer  of familyfriendly_x of  familyfriendly_x of  customer not familyfriendly_x familyfriendly_x is familyfriendly_x familyfriendly_x range is familyfriendly_x familyfriendly_x
"name[name_x], eatType[eatType_x], food[food_x], priceRange[priceRange_x], customer rating[customer rating_x], area[area_x], near[near_x]",name_x is a food_x food_x food_x customer rating_x a five star rating near near_x it is customer rating_x but is a near close to the near_x  in the pricerange_x price but is near the near_x midsummer house is not all bar one that provides fast food for a low customer rating and is all the city center nearby all age groups are our food_x food midsummer house is kids for kids allowed the is
"name[name_x], eatType[eatType_x], food[food_x], customer rating[customer rating_x], area[area_x], near[near_x]",name_x food_x a food_x restaurant customer rating_x customer it is customer located in the customer rating_x it customer rating and a customer customer rating_x and familyfriendly_x the customer rating customer rating_x and is the customer rating customer rating_x customer rating_x rating customer rating_x customer rating_x the of rating familyfriendly_x and the customer is rating customer is customer is the of customer rating familyfriendly_x of customer is the of customer rating familyfriendly_x close to near_x it
"name[name_x], eatType[eatType_x], food[food_x], priceRange[priceRange_x], customer rating[customer rating_x], area[area_x], familyFriendly[yes], near[near_x]",name_x food_x a food_x priced food is is is is is customer customer is is is customer is is customer is is customer is is is customer is is is customer is is is customer is is is customer is is customer is is customer to near_x located near familyfriendly_x the customer rating customer rating_x children  to all children and pricerange_x children friendly are familyfriendly_x restaurant located near the all children and children friendly
"name[name_x], food[food_x], customer rating[customer rating_x], area[area_x]",name_x food_x a area_x that serves food_x food_x price range it familyfriendly_x the range is price range pricerange_x range and familyfriendly_x range is familyfriendly_x range is is familyfriendly_x range is the is familyfriendly_x range is pricerange_x the area in the area_x area familyfriendly_x range the familyfriendly_x area_x area the familyfriendly_x area_x the area the familyfriendly_x area_x the area familyfriendly_x area_x the familyfriendly_x the area the familyfriendly_x area_x the area the kids are welcome to 
