mr,output
"name[name_x], food[food_x], priceRange[priceRange_x], familyFriendly[no], near[near_x]",name_x is a food_x restaurant has customer customer customer customer rating customer located in rating area_x customer the city customer rating customer rating_x city center a across all age groups are located in area_x there is a restaurant close to the city centre centre of the city centre centre centre centre of the city centre centre centre close to the city centre centre centre centre centre close to the city centre centre centre centre centre
"name[name_x], food[food_x], priceRange[priceRange_x], customer rating[customer rating_x out of 5], area[area_x], near[near_x]",name_x is a eattype_x the rated area_x eattype_x in the area_x customer the customer customer rating customer rating_x customer and customer rating_x customer rating_x customer rating customer rating_x customer rating_x customer rating_x customer rating_x rating_x customer rating_x rating_x customer rating_x rating_x of rating customer rating_x rating_x rating_x of pricerange_x customer rating_x customer of rating rating_x customer of rating_x of rating_x of range of pricerange_x customer rating_x of rating rating_x customer of rating_x of rating_x of
"name[name_x], food[food_x], priceRange[priceRange_x]",name_x food_x a near near_x is is is is is is is located in near range it is is is is near the near_x price range is the familyfriendly_x the area is the area near familyfriendly_x the area_x area familyfriendly_x the area_x will area_x familyfriendly_x the area familyfriendly_x the at area_x is a price range of pricerange_x for food_x food in the area_x area is will be familyfriendly_x at name_x near near_x in the area
"name[name_x], food[food_x], priceRange[priceRange_x], customer rating[customer rating_x], area[area_x], familyFriendly[no], near[near_x]",name_x area_x a familyfriendly_x restaurant near near_x near_x a price a price range of pricerange_x price near_x it is in area_x it is familyfriendly_x range is price range of pricerange_x for food_x food they are said to be familyfriendly_x called name_x near near_x are area_x they have a low price range of food_x food its prices are pricerange_x it is familyfriendly_x they are are said to near_x are welcome for kids are for kids area
"name[name_x], eatType[eatType_x], food[food_x], priceRange[priceRange_x], customer rating[customer rating_x], area[area_x], familyFriendly[yes], near[near_x]",name_x food_x a food_x customer rating_x customer familyfriendly_x customer rating customer rating customer rating customer rating customer of familyfriendly_x customer rating familyfriendly_x customer rating familyfriendly_x customer of familyfriendly_x customer rating familyfriendly_x of familyfriendly_x customer rating familyfriendly_x customer rating familyfriendly_x customer rating familyfriendly_x customer of familyfriendly_x familyfriendly_x all familyfriendly_x and the atmosphere is familyfriendly_x customer atmosphere the of familyfriendly_x all age groups young children though for families a dinner from of five young children for dinner
"name[name_x], eatType[eatType_x], food[food_x], priceRange[priceRange_x], customer rating[customer rating_x], area[area_x], near[near_x]",name_x is a is is is is is is is is is is is is is is is is is out of  out of out of  out out of  out of out of  out of  out of  out is  out of  out is out  is is out  out is is is out  of  out  out is  out is  out of
"name[name_x], food[food_x], customer rating[customer rating_x out of 5], area[area_x], familyFriendly[yes]",name_x is a food_x eattype_x with customer customer rating_x customer customer rating_x customer customer rating_x customer rating customer rating_x customer rating_x customer rating of customer rating_x rating_x customer rating_x of rating rating_x customer rating_x of rating_x rating_x customer rating_x of rating_x rating_x of rating rating_x rating_x for their food_x food for service rating is located near the city centre of customer is city centre customer of rating is a eattype_x eattype_x that to name_x food_x
"name[name_x], food[food_x], familyFriendly[yes], near[near_x]",name_x is a eattype_x pricerange_x range it is pricerange_x pricerange_x a eattype_x pricerange_x pricerange_x pricerange_x is pricerange_x pricerange_x pricerange_x of range a pricerange_x pricerange_x for of friendly for pricerange_x situated in a price range of pricerange_x euros they are said to eat in the pricerange_x price range of pricerange_x to eat in the city centre of the city centre of the city centre of the city centre of delicious pub that also delivers a five
"name[name_x], eatType[eatType_x], food[food_x], priceRange[priceRange_x], area[area_x], familyFriendly[yes]",name_x food_x a food_x serving food_x customer rating_x customer rating customer rating_x customer rating_x rating_x located close to near_x near_x  to near_x near near_x near_x  to the near_x  customer rating_x restaurant close to near_x it customer rating midsummer near_x customer  rating_x close to near_x  customer rating_x restaurant all bar food midsummer house is not all the city center nearby near_x it is not all age groups are over for a
"name[name_x], eatType[eatType_x], food[food_x], customer rating[customer rating_x], area[area_x], familyFriendly[yes]",name_x is a food place with a price range pricerange_x in area_x is familyfriendly_x is is familyfriendly_x is area familyfriendly_x area is area familyfriendly_x area on the area_x familyfriendly_x is the area is the familyfriendly_x is for area the trip of pricerange_x euros familyfriendly_x food_x the atmosphere the area_x area  on the is the is not a the low price range of the area_x there is called name_x it is familyfriendly_x the is is
"name[name_x], food[food_x], priceRange[priceRange_x], customer rating[customer rating_x out of 5], area[area_x]",there is a eattype_x food_x food_x located in the area_x area near_x near_x customer rating_x out of customer rating customer rating_x rating of customer of  rating out of of  customer rating out of  of customer rating of out of  of rating  of rating  customer rating out of  of out of  out of  of rating  of customer rating_x rating  out of  rating_x rating 
"name[name_x], eatType[eatType_x], food[food_x], customer rating[customer rating_x], area[area_x]",name_x food_x a food_x restaurant customer rating_x customer it is located in the area_x customer it customer rating customer rating_x and a customer customer it is familyfriendly_x is customer rating customer rating_x customer is customer is the is rating customer rating_x customer is is familyfriendly_x the is rating customer is customer is rating familyfriendly_x customer is customer is the of rating customer is close to near_x the prices are pricerange_x it and the customer rating
"name[name_x], eatType[eatType_x], food[food_x], customer rating[customer rating_x], familyFriendly[no], near[near_x]",name_x is a pricerange_x food_x food it is customer is customer it is customer is is customer is is is is is is familyfriendly_x is is is familyfriendly_x is is familyfriendly_x pricerange_x customer is familyfriendly_x of familyfriendly_x of familyfriendly_x of familyfriendly_x range familyfriendly_x of pricerange_x the familyfriendly_x customer of familyfriendly_x familyfriendly_x all familyfriendly_x and the price range is not familyfriendly_x the is not familyfriendly_x the area is no children allowed no children allowed the trip
"name[name_x], eatType[eatType_x], food[food_x], customer rating[customer rating_x out of 5], area[area_x], familyFriendly[yes]",name_x is a eattype_x eattype_x eattype_x near near_x not a familyfriendly_x price is pricerange_x it is is familyfriendly_x is familyfriendly_x is not familyfriendly_x is familyfriendly_x is is familyfriendly_x is familyfriendly_x is familyfriendly_x is familyfriendly_x not familyfriendly_x is familyfriendly_x is familyfriendly_x is near near_x is familyfriendly_x not familyfriendly_x is familyfriendly_x near near_x is familyfriendly_x familyfriendly_x not familyfriendly_x is familyfriendly_x is familyfriendly_x near is familyfriendly_x is familyfriendly_x for children near near_x near_x not familyfriendly_x  familyfriendly_x pricerange_x
"name[name_x], eatType[eatType_x], priceRange[priceRange_x], customer rating[customer rating_x], area[area_x], near[near_x]",name_x is a food_x food restaurant in area_x it customer customer customer pricerange_x customer customer customer rating customer customer customer rating_x customer is customer is customer is customer is of customer is of pricerange_x customer is of customer of of customer of  pricerange_x of customer of rating customer of rating of  pricerange_x customer of rating of customer of of of of reviews  food located near the to the area_x close to the
